{"proceso":"admin-catalog","nombre":"admin-catalog","tipo":"MODULO","roles":["Cualquier sesión válida"],"nodos":[{"id":"etapa:ctrl:sin controlador","tipo":"ETAPA","etiqueta":"ctrl:sin controlador · Operaciones de sin controlador que el README no asigna a un caso de uso"},{"id":"op:adminCatalogReviewAnnotation","tipo":"OPERACION","etiqueta":"POST /admin/catalog/annotations/{id}/review","operacionId":"adminCatalogReviewAnnotation","riesgo":"BAJO","etapa":"ctrl:sin controlador"},{"id":"actor:Cualquier sesión válida","tipo":"ACTOR","etiqueta":"Cualquier sesión válida"},{"id":"op:adminCatalogGetCoverage","tipo":"OPERACION","etiqueta":"GET /admin/catalog/coverage","operacionId":"adminCatalogGetCoverage","riesgo":"BAJO","etapa":"ctrl:sin controlador"},{"id":"op:adminCatalogListObjects","tipo":"OPERACION","etiqueta":"GET /admin/catalog/objects","operacionId":"adminCatalogListObjects","riesgo":"BAJO","etapa":"ctrl:sin controlador"},{"id":"op:adminCatalogGetObject","tipo":"OPERACION","etiqueta":"GET /admin/catalog/objects/{id}","operacionId":"adminCatalogGetObject","riesgo":"BAJO","etapa":"ctrl:sin controlador"},{"id":"op:adminCatalogSaveAnnotation","tipo":"OPERACION","etiqueta":"PUT /admin/catalog/objects/{id}/annotation","operacionId":"adminCatalogSaveAnnotation","riesgo":"BAJO","etapa":"ctrl:sin controlador"},{"id":"op:adminCatalogListChanges","tipo":"OPERACION","etiqueta":"GET /admin/catalog/objects/{id}/changes","operacionId":"adminCatalogListChanges","riesgo":"BAJO","etapa":"ctrl:sin controlador"},{"id":"op:adminCatalogListColumns","tipo":"OPERACION","etiqueta":"GET /admin/catalog/objects/{id}/columns","operacionId":"adminCatalogListColumns","riesgo":"BAJO","etapa":"ctrl:sin controlador"},{"id":"op:adminCatalogListEvidence","tipo":"OPERACION","etiqueta":"GET /admin/catalog/objects/{id}/evidence","operacionId":"adminCatalogListEvidence","riesgo":"BAJO","etapa":"ctrl:sin controlador"},{"id":"op:adminCatalogAddEvidence","tipo":"OPERACION","etiqueta":"POST /admin/catalog/objects/{id}/evidence","operacionId":"adminCatalogAddEvidence","riesgo":"BAJO","etapa":"ctrl:sin controlador"},{"id":"op:adminCatalogGetHistory","tipo":"OPERACION","etiqueta":"GET /admin/catalog/objects/{id}/history","operacionId":"adminCatalogGetHistory","riesgo":"BAJO","etapa":"ctrl:sin controlador"},{"id":"op:adminCatalogGetImpact","tipo":"OPERACION","etiqueta":"GET /admin/catalog/objects/{id}/impact","operacionId":"adminCatalogGetImpact","riesgo":"BAJO","etapa":"ctrl:sin controlador"},{"id":"op:adminCatalogListScans","tipo":"OPERACION","etiqueta":"GET /admin/catalog/scans","operacionId":"adminCatalogListScans","riesgo":"BAJO","etapa":"ctrl:sin controlador"},{"id":"op:adminCatalogRequestScan","tipo":"OPERACION","etiqueta":"POST /admin/catalog/scans","operacionId":"adminCatalogRequestScan","riesgo":"BAJO","etapa":"ctrl:sin controlador"},{"id":"op:adminCatalogGetScan","tipo":"OPERACION","etiqueta":"GET /admin/catalog/scans/{id}","operacionId":"adminCatalogGetScan","riesgo":"BAJO","etapa":"ctrl:sin controlador"},{"id":"op:adminCatalogListSchemas","tipo":"OPERACION","etiqueta":"GET /admin/catalog/schemas","operacionId":"adminCatalogListSchemas","riesgo":"BAJO","etapa":"ctrl:sin controlador"}],"aristas":[{"de":"etapa:ctrl:sin controlador","a":"op:adminCatalogReviewAnnotation","tipo":"CONTIENE"},{"de":"actor:Cualquier sesión válida","a":"op:adminCatalogReviewAnnotation","tipo":"ACTUA"},{"de":"etapa:ctrl:sin controlador","a":"op:adminCatalogGetCoverage","tipo":"CONTIENE"},{"de":"actor:Cualquier sesión válida","a":"op:adminCatalogGetCoverage","tipo":"ACTUA"},{"de":"etapa:ctrl:sin controlador","a":"op:adminCatalogListObjects","tipo":"CONTIENE"},{"de":"actor:Cualquier sesión válida","a":"op:adminCatalogListObjects","tipo":"ACTUA"},{"de":"etapa:ctrl:sin controlador","a":"op:adminCatalogGetObject","tipo":"CONTIENE"},{"de":"actor:Cualquier sesión válida","a":"op:adminCatalogGetObject","tipo":"ACTUA"},{"de":"etapa:ctrl:sin controlador","a":"op:adminCatalogSaveAnnotation","tipo":"CONTIENE"},{"de":"actor:Cualquier sesión válida","a":"op:adminCatalogSaveAnnotation","tipo":"ACTUA"},{"de":"etapa:ctrl:sin controlador","a":"op:adminCatalogListChanges","tipo":"CONTIENE"},{"de":"actor:Cualquier sesión válida","a":"op:adminCatalogListChanges","tipo":"ACTUA"},{"de":"etapa:ctrl:sin controlador","a":"op:adminCatalogListColumns","tipo":"CONTIENE"},{"de":"actor:Cualquier sesión válida","a":"op:adminCatalogListColumns","tipo":"ACTUA"},{"de":"etapa:ctrl:sin controlador","a":"op:adminCatalogListEvidence","tipo":"CONTIENE"},{"de":"actor:Cualquier sesión válida","a":"op:adminCatalogListEvidence","tipo":"ACTUA"},{"de":"etapa:ctrl:sin controlador","a":"op:adminCatalogAddEvidence","tipo":"CONTIENE"},{"de":"actor:Cualquier sesión válida","a":"op:adminCatalogAddEvidence","tipo":"ACTUA"},{"de":"etapa:ctrl:sin controlador","a":"op:adminCatalogGetHistory","tipo":"CONTIENE"},{"de":"actor:Cualquier sesión válida","a":"op:adminCatalogGetHistory","tipo":"ACTUA"},{"de":"etapa:ctrl:sin controlador","a":"op:adminCatalogGetImpact","tipo":"CONTIENE"},{"de":"actor:Cualquier sesión válida","a":"op:adminCatalogGetImpact","tipo":"ACTUA"},{"de":"etapa:ctrl:sin controlador","a":"op:adminCatalogListScans","tipo":"CONTIENE"},{"de":"actor:Cualquier sesión válida","a":"op:adminCatalogListScans","tipo":"ACTUA"},{"de":"etapa:ctrl:sin controlador","a":"op:adminCatalogRequestScan","tipo":"CONTIENE"},{"de":"actor:Cualquier sesión válida","a":"op:adminCatalogRequestScan","tipo":"ACTUA"},{"de":"etapa:ctrl:sin controlador","a":"op:adminCatalogGetScan","tipo":"CONTIENE"},{"de":"actor:Cualquier sesión válida","a":"op:adminCatalogGetScan","tipo":"ACTUA"},{"de":"etapa:ctrl:sin controlador","a":"op:adminCatalogListSchemas","tipo":"CONTIENE"},{"de":"actor:Cualquier sesión válida","a":"op:adminCatalogListSchemas","tipo":"ACTUA"}]}
