{"proceso":"governance_admin","nombre":"governance_admin","tipo":"MODULO","roles":["GOVERNANCE_ADMIN · DATA_PLATFORM_ADMIN · DATA_STEWARD · PLATFORM_ADMIN","SECURITY_ADMIN · PLATFORM_ADMIN · GOVERNANCE_ADMIN · DATA_PLATFORM_ADMIN · DPO · AUDITOR · DATA_STEWARD"],"nodos":[{"id":"etapa:ctrl:AdminDataQualityController","tipo":"ETAPA","etiqueta":"ctrl:AdminDataQualityController · Operaciones de AdminDataQualityController que el README no asigna a un caso de uso"},{"id":"op:AdminDataQualityController_issues","tipo":"OPERACION","etiqueta":"GET /admin/governance/data-quality/issues","operacionId":"AdminDataQualityController_issues","riesgo":"BAJO","etapa":"ctrl:AdminDataQualityController"},{"id":"actor:SECURITY_ADMIN · PLATFORM_ADMIN · GOVERNANCE_ADMIN · DATA_PLATFORM_ADMIN · DPO · AUDITOR · DATA_STEWARD","tipo":"ACTOR","etiqueta":"SECURITY_ADMIN · PLATFORM_ADMIN · GOVERNANCE_ADMIN · DATA_PLATFORM_ADMIN · DPO · AUDITOR · DATA_STEWARD"},{"id":"tabla:health_data.health_data_quality_issues","tipo":"TABLA","etiqueta":"health_data.health_data_quality_issues"},{"id":"tabla:health_data.health_data_quality_rules","tipo":"TABLA","etiqueta":"health_data.health_data_quality_rules"},{"id":"tabla:health_data.health_data_quality_runs","tipo":"TABLA","etiqueta":"health_data.health_data_quality_runs"},{"id":"op:AdminDataQualityController_issue","tipo":"OPERACION","etiqueta":"GET /admin/governance/data-quality/issues/{id}","operacionId":"AdminDataQualityController_issue","riesgo":"BAJO","etapa":"ctrl:AdminDataQualityController"},{"id":"op:AdminDataQualityController_resolve","tipo":"OPERACION","etiqueta":"POST /admin/governance/data-quality/issues/{id}/resolution","operacionId":"AdminDataQualityController_resolve","riesgo":"MEDIO","etapa":"ctrl:AdminDataQualityController"},{"id":"actor:GOVERNANCE_ADMIN · DATA_PLATFORM_ADMIN · DATA_STEWARD · PLATFORM_ADMIN","tipo":"ACTOR","etiqueta":"GOVERNANCE_ADMIN · DATA_PLATFORM_ADMIN · DATA_STEWARD · PLATFORM_ADMIN"},{"id":"op:AdminDataQualityController_rules","tipo":"OPERACION","etiqueta":"GET /admin/governance/data-quality/rules","operacionId":"AdminDataQualityController_rules","riesgo":"BAJO","etapa":"ctrl:AdminDataQualityController"},{"id":"tabla:health_data.health_data_quality_rule_sets","tipo":"TABLA","etiqueta":"health_data.health_data_quality_rule_sets"},{"id":"tabla:terminology.catalog_concepts","tipo":"TABLA","etiqueta":"terminology.catalog_concepts"},{"id":"op:AdminDataQualityController_rule","tipo":"OPERACION","etiqueta":"GET /admin/governance/data-quality/rules/{id}","operacionId":"AdminDataQualityController_rule","riesgo":"BAJO","etapa":"ctrl:AdminDataQualityController"},{"id":"etapa:ctrl:AdminPrivacyRequestsController","tipo":"ETAPA","etiqueta":"ctrl:AdminPrivacyRequestsController · Operaciones de AdminPrivacyRequestsController que el README no asigna a un caso de uso"},{"id":"op:AdminPrivacyRequestsController_list","tipo":"OPERACION","etiqueta":"GET /admin/governance/privacy-requests","operacionId":"AdminPrivacyRequestsController_list","riesgo":"BAJO","etapa":"ctrl:AdminPrivacyRequestsController"},{"id":"tabla:audit.dsar_requests","tipo":"TABLA","etiqueta":"audit.dsar_requests"},{"id":"op:AdminPrivacyRequestsController_get","tipo":"OPERACION","etiqueta":"GET /admin/governance/privacy-requests/{id}","operacionId":"AdminPrivacyRequestsController_get","riesgo":"BAJO","etapa":"ctrl:AdminPrivacyRequestsController"}],"aristas":[{"de":"etapa:ctrl:AdminDataQualityController","a":"op:AdminDataQualityController_issues","tipo":"CONTIENE"},{"de":"actor:SECURITY_ADMIN · PLATFORM_ADMIN · GOVERNANCE_ADMIN · DATA_PLATFORM_ADMIN · DPO · AUDITOR · DATA_STEWARD","a":"op:AdminDataQualityController_issues","tipo":"ACTUA"},{"de":"op:AdminDataQualityController_issues","a":"tabla:health_data.health_data_quality_issues","tipo":"LEE","etiqueta":"LEE"},{"de":"op:AdminDataQualityController_issues","a":"tabla:health_data.health_data_quality_rules","tipo":"LEE","etiqueta":"LEE"},{"de":"op:AdminDataQualityController_issues","a":"tabla:health_data.health_data_quality_runs","tipo":"LEE","etiqueta":"LEE"},{"de":"etapa:ctrl:AdminDataQualityController","a":"op:AdminDataQualityController_issue","tipo":"CONTIENE"},{"de":"actor:SECURITY_ADMIN · PLATFORM_ADMIN · GOVERNANCE_ADMIN · DATA_PLATFORM_ADMIN · DPO · AUDITOR · DATA_STEWARD","a":"op:AdminDataQualityController_issue","tipo":"ACTUA"},{"de":"op:AdminDataQualityController_issue","a":"tabla:health_data.health_data_quality_issues","tipo":"LEE","etiqueta":"LEE"},{"de":"op:AdminDataQualityController_issue","a":"tabla:health_data.health_data_quality_rules","tipo":"LEE","etiqueta":"LEE"},{"de":"op:AdminDataQualityController_issue","a":"tabla:health_data.health_data_quality_runs","tipo":"LEE","etiqueta":"LEE"},{"de":"etapa:ctrl:AdminDataQualityController","a":"op:AdminDataQualityController_resolve","tipo":"CONTIENE"},{"de":"actor:GOVERNANCE_ADMIN · DATA_PLATFORM_ADMIN · DATA_STEWARD · PLATFORM_ADMIN","a":"op:AdminDataQualityController_resolve","tipo":"ACTUA"},{"de":"op:AdminDataQualityController_resolve","a":"tabla:health_data.health_data_quality_issues","tipo":"ESCRIBE","etiqueta":"ACTUALIZA"},{"de":"op:AdminDataQualityController_resolve","a":"tabla:health_data.health_data_quality_issues","tipo":"LEE","etiqueta":"LEE"},{"de":"op:AdminDataQualityController_resolve","a":"tabla:health_data.health_data_quality_rules","tipo":"LEE","etiqueta":"LEE"},{"de":"op:AdminDataQualityController_resolve","a":"tabla:health_data.health_data_quality_runs","tipo":"LEE","etiqueta":"LEE"},{"de":"etapa:ctrl:AdminDataQualityController","a":"op:AdminDataQualityController_rules","tipo":"CONTIENE"},{"de":"actor:SECURITY_ADMIN · PLATFORM_ADMIN · GOVERNANCE_ADMIN · DATA_PLATFORM_ADMIN · DPO · AUDITOR · DATA_STEWARD","a":"op:AdminDataQualityController_rules","tipo":"ACTUA"},{"de":"op:AdminDataQualityController_rules","a":"tabla:health_data.health_data_quality_rule_sets","tipo":"LEE","etiqueta":"LEE"},{"de":"op:AdminDataQualityController_rules","a":"tabla:health_data.health_data_quality_rules","tipo":"LEE","etiqueta":"LEE"},{"de":"op:AdminDataQualityController_rules","a":"tabla:terminology.catalog_concepts","tipo":"LEE","etiqueta":"LEE"},{"de":"etapa:ctrl:AdminDataQualityController","a":"op:AdminDataQualityController_rule","tipo":"CONTIENE"},{"de":"actor:SECURITY_ADMIN · PLATFORM_ADMIN · GOVERNANCE_ADMIN · DATA_PLATFORM_ADMIN · DPO · AUDITOR · DATA_STEWARD","a":"op:AdminDataQualityController_rule","tipo":"ACTUA"},{"de":"op:AdminDataQualityController_rule","a":"tabla:health_data.health_data_quality_issues","tipo":"LEE","etiqueta":"LEE"},{"de":"op:AdminDataQualityController_rule","a":"tabla:health_data.health_data_quality_rule_sets","tipo":"LEE","etiqueta":"LEE"},{"de":"op:AdminDataQualityController_rule","a":"tabla:health_data.health_data_quality_rules","tipo":"LEE","etiqueta":"LEE"},{"de":"op:AdminDataQualityController_rule","a":"tabla:health_data.health_data_quality_runs","tipo":"LEE","etiqueta":"LEE"},{"de":"op:AdminDataQualityController_rule","a":"tabla:terminology.catalog_concepts","tipo":"LEE","etiqueta":"LEE"},{"de":"etapa:ctrl:AdminPrivacyRequestsController","a":"op:AdminPrivacyRequestsController_list","tipo":"CONTIENE"},{"de":"actor:SECURITY_ADMIN · PLATFORM_ADMIN · GOVERNANCE_ADMIN · DATA_PLATFORM_ADMIN · DPO · AUDITOR · DATA_STEWARD","a":"op:AdminPrivacyRequestsController_list","tipo":"ACTUA"},{"de":"op:AdminPrivacyRequestsController_list","a":"tabla:audit.dsar_requests","tipo":"LEE","etiqueta":"LEE"},{"de":"etapa:ctrl:AdminPrivacyRequestsController","a":"op:AdminPrivacyRequestsController_get","tipo":"CONTIENE"},{"de":"actor:SECURITY_ADMIN · PLATFORM_ADMIN · GOVERNANCE_ADMIN · DATA_PLATFORM_ADMIN · DPO · AUDITOR · DATA_STEWARD","a":"op:AdminPrivacyRequestsController_get","tipo":"ACTUA"},{"de":"op:AdminPrivacyRequestsController_get","a":"tabla:audit.dsar_requests","tipo":"LEE","etiqueta":"LEE"}]}
