{"proceso":"app","nombre":"app","tipo":"MODULO","roles":["Cualquier sesión válida","PLATFORM_ADMIN · SRE · SECURITY_ADMIN","Público (sin sesión)"],"nodos":[{"id":"etapa:ctrl:AppController","tipo":"ETAPA","etiqueta":"ctrl:AppController · Operaciones de AppController que el README no asigna a un caso de uso"},{"id":"op:AppController_getHello","tipo":"OPERACION","etiqueta":"GET /","operacionId":"AppController_getHello","riesgo":"BAJO","etapa":"ctrl:AppController"},{"id":"actor:Cualquier sesión válida","tipo":"ACTOR","etiqueta":"Cualquier sesión válida"},{"id":"op:AppController_health","tipo":"OPERACION","etiqueta":"GET /health","operacionId":"AppController_health","riesgo":"BAJO","etapa":"ctrl:AppController"},{"id":"actor:Público (sin sesión)","tipo":"ACTOR","etiqueta":"Público (sin sesión)"},{"id":"op:AppController_liveness","tipo":"OPERACION","etiqueta":"GET /liveness","operacionId":"AppController_liveness","riesgo":"BAJO","etapa":"ctrl:AppController"},{"id":"op:AppController_readiness","tipo":"OPERACION","etiqueta":"GET /readiness","operacionId":"AppController_readiness","riesgo":"BAJO","etapa":"ctrl:AppController"},{"id":"etapa:ctrl:DataSourcesController","tipo":"ETAPA","etiqueta":"ctrl:DataSourcesController · Operaciones de DataSourcesController que el README no asigna a un caso de uso"},{"id":"op:DataSourcesController_dataSources","tipo":"OPERACION","etiqueta":"GET /health/data-sources","operacionId":"DataSourcesController_dataSources","riesgo":"BAJO","etapa":"ctrl:DataSourcesController"},{"id":"actor:PLATFORM_ADMIN · SRE · SECURITY_ADMIN","tipo":"ACTOR","etiqueta":"PLATFORM_ADMIN · SRE · SECURITY_ADMIN"},{"id":"op:DataSourcesController_metrics","tipo":"OPERACION","etiqueta":"GET /health/data-sources/metrics","operacionId":"DataSourcesController_metrics","riesgo":"BAJO","etapa":"ctrl:DataSourcesController"}],"aristas":[{"de":"etapa:ctrl:AppController","a":"op:AppController_getHello","tipo":"CONTIENE"},{"de":"actor:Cualquier sesión válida","a":"op:AppController_getHello","tipo":"ACTUA"},{"de":"etapa:ctrl:AppController","a":"op:AppController_health","tipo":"CONTIENE"},{"de":"actor:Público (sin sesión)","a":"op:AppController_health","tipo":"ACTUA"},{"de":"etapa:ctrl:AppController","a":"op:AppController_liveness","tipo":"CONTIENE"},{"de":"actor:Público (sin sesión)","a":"op:AppController_liveness","tipo":"ACTUA"},{"de":"etapa:ctrl:AppController","a":"op:AppController_readiness","tipo":"CONTIENE"},{"de":"actor:Público (sin sesión)","a":"op:AppController_readiness","tipo":"ACTUA"},{"de":"etapa:ctrl:DataSourcesController","a":"op:DataSourcesController_dataSources","tipo":"CONTIENE"},{"de":"actor:PLATFORM_ADMIN · SRE · SECURITY_ADMIN","a":"op:DataSourcesController_dataSources","tipo":"ACTUA"},{"de":"etapa:ctrl:DataSourcesController","a":"op:DataSourcesController_metrics","tipo":"CONTIENE"},{"de":"actor:PLATFORM_ADMIN · SRE · SECURITY_ADMIN","a":"op:DataSourcesController_metrics","tipo":"ACTUA"}]}
